<?xml version="1.0" encoding="UTF-8" ?>
<!ELEMENT E24HDO_kurzusfelvetel (hallgató+, kurzusok+)>
<!ATTLIST E24HDO_kurzusfelvetel tanév CDATA #REQUIRED>
<!ATTLIST E24HDO_kurzusfelvetel egyetem CDATA #REQUIRED>
<!ELEMENT hallgató (hallgato)>
<!ELEMENT hallgato (hnev, szulev, szak)>
<!ELEMENT hnev (#PCDATA)>
<!ELEMENT szulev (#PCDATA)>
<!ELEMENT szak (#PCDATA)>
<!ATTLIST szak evf (#PCDATA) #REQUIRED>
<!ELEMENT kurzusok (kurzus)>
<!ELEMENT kurzus (kurzusnev, kredit, hely, idopont+, (oktato | oraado))>
<!ATTLIST kurzus id ID #REQUIRED>
<!ATTLIST kurzus jovahagyas (igen | nem) "nem" #IMPLIED>
<!ATTLIST kurzus nyelv CDATA #IMPLIED>
<!ELEMENT kurzusnev (#PCDATA)>
<!ELEMENT kredit (#PCDATA)>
<!ELEMENT hely (#PCDATA)>
<!ELEMENT idopont (#PCDATA)>
<!ELEMENT oktato (#PCDATA)>
<!ELEMENT oraado (#PCDATA)>